{
  "authority": {
    "allowed_output_paths": [
      "AI/generated/ROADMAP_STATE.json",
      "AI/generated/ROADMAP_STATE.md",
      "runtime/control-center/action-audit.jsonl"
    ],
    "control_center_mode": "read_only",
    "live_authority": false,
    "p12_heal_friend_reopened": false,
    "roadmap_refresh_risk_class": "safe_write",
    "roadmap_refresh_tool_enabled": true,
    "runtime_actions": false,
    "runtime_executor_added": false,
    "runtime_mcp_write_tool_enabled": false
  },
  "blockers": [],
  "control_center_preflight": {
    "cockpit_handoff_status": "ready",
    "hard_blockers": [],
    "operator_brief_status": "ready",
    "ready": true,
    "roadmap_generation_status": "ready",
    "status": "ready"
  },
  "freshness_status": "current",
  "generated_at": "2026-07-16T18:22:52.727961Z",
  "ledger": [
    {
      "age_seconds": 90707,
      "attempt_count": null,
      "bindings": [],
      "blockers": [],
      "created_at": "2026-07-15T17:11:05Z",
      "decision_id": "p8-background-acceptance",
      "decision_status": "accepted",
      "dispatch_allowed": false,
      "downstream_authority_granted": false,
      "evidence_path": "runtime/solteria_helper_dev/background_status.json",
      "evidence_schema_version": "ctoa.otclient-headless-status.v1",
      "evidence_sha256": "f871b64e7c1981c591b3013ab2b3560417e3bdc26c5aae4d74949bcb6501df78",
      "evidence_status": "ready",
      "execute_once_allowed": false,
      "final_state": null,
      "freshness_status": "immutable_terminal",
      "integrity_status": "passed",
      "intrusive_action_count": 0,
      "lane": "background",
      "live_promotion": false,
      "ordinal": 8,
      "phase": "P8",
      "predecessor_ids": [],
      "previous_evidence_sha256": "f871b64e7c1981c591b3013ab2b3560417e3bdc26c5aae4d74949bcb6501df78",
      "result_status": "operational_acceptance_complete",
      "retry_scheduled": null,
      "runtime_actions": false,
      "terminal": true
    },
    {
      "age_seconds": 171441,
      "attempt_count": null,
      "bindings": [
        {
          "actual_sha256": "795c2d4b1a130376335035d144be1cff609fe51ed826a75f46530571579ce0df",
          "expected_sha256": "795c2d4b1a130376335035d144be1cff609fe51ed826a75f46530571579ce0df",
          "mode": "canonical_json_sha256",
          "path": "runtime/solteria_helper_dev/conditions_shadow_replay.json",
          "role": "report",
          "status": "passed"
        }
      ],
      "blockers": [],
      "created_at": "2026-07-14T18:45:31.632000Z",
      "decision_id": "p9-conditions-shadow-acceptance",
      "decision_status": "accepted",
      "dispatch_allowed": false,
      "downstream_authority_granted": false,
      "evidence_path": "runtime/solteria_helper_dev/conditions_shadow_acceptance.json",
      "evidence_schema_version": "ctoa.conditions-shadow-acceptance.v1",
      "evidence_sha256": "cd251c883ca83e83769b5c1cd6721dd6062b1913c2614388070d04b560afde8a",
      "evidence_status": "accepted",
      "execute_once_allowed": false,
      "final_state": null,
      "freshness_status": "immutable_terminal",
      "integrity_status": "passed",
      "intrusive_action_count": 0,
      "lane": "conditions",
      "live_promotion": false,
      "ordinal": 9,
      "phase": "P9",
      "predecessor_ids": [
        "p8-background-acceptance"
      ],
      "previous_evidence_sha256": "cd251c883ca83e83769b5c1cd6721dd6062b1913c2614388070d04b560afde8a",
      "result_status": "operational_acceptance_complete",
      "retry_scheduled": null,
      "runtime_actions": false,
      "terminal": true
    },
    {
      "age_seconds": 135761,
      "attempt_count": null,
      "bindings": [
        {
          "actual_sha256": "e3f9048a7432593ff010f5dee0229d0cc42d6c221ef9b4c8028523896bd5c16e",
          "expected_sha256": "e3f9048a7432593ff010f5dee0229d0cc42d6c221ef9b4c8028523896bd5c16e",
          "mode": "canonical_json_sha256",
          "path": "runtime/solteria_helper_dev/equipment_shadow_replay.json",
          "role": "report",
          "status": "passed"
        }
      ],
      "blockers": [],
      "created_at": "2026-07-15T04:40:11.067000Z",
      "decision_id": "p10-equipment-shadow-acceptance",
      "decision_status": "accepted",
      "dispatch_allowed": false,
      "downstream_authority_granted": false,
      "evidence_path": "runtime/solteria_helper_dev/equipment_shadow_acceptance.json",
      "evidence_schema_version": "ctoa.equipment-shadow-acceptance.v1",
      "evidence_sha256": "ca062e4ddc41029dbae059bae303e6b4a5b4a87a66442c7f846ae050a3fa9548",
      "evidence_status": "accepted",
      "execute_once_allowed": false,
      "final_state": null,
      "freshness_status": "immutable_terminal",
      "integrity_status": "passed",
      "intrusive_action_count": 0,
      "lane": "equipment",
      "live_promotion": false,
      "ordinal": 10,
      "phase": "P10",
      "predecessor_ids": [
        "p9-conditions-shadow-acceptance"
      ],
      "previous_evidence_sha256": "ca062e4ddc41029dbae059bae303e6b4a5b4a87a66442c7f846ae050a3fa9548",
      "result_status": "operational_acceptance_complete",
      "retry_scheduled": null,
      "runtime_actions": false,
      "terminal": true
    },
    {
      "age_seconds": 132379,
      "attempt_count": null,
      "bindings": [
        {
          "actual_sha256": "b6d5f8e53c7e7354445ab9b134b4b04a7bda984df93c477ed2cbb2a57d575ed8",
          "expected_sha256": "b6d5f8e53c7e7354445ab9b134b4b04a7bda984df93c477ed2cbb2a57d575ed8",
          "mode": "canonical_json_sha256",
          "path": "runtime/solteria_helper_dev/heal_friend_shadow_replay.json",
          "role": "report",
          "status": "passed"
        }
      ],
      "blockers": [],
      "created_at": "2026-07-15T05:36:33.724000Z",
      "decision_id": "p11-heal-friend-shadow-acceptance",
      "decision_status": "accepted",
      "dispatch_allowed": false,
      "downstream_authority_granted": false,
      "evidence_path": "runtime/solteria_helper_dev/heal_friend_shadow_acceptance.json",
      "evidence_schema_version": "ctoa.heal-friend-shadow-acceptance.v1",
      "evidence_sha256": "9bce6d49dc9177aa962a9eec7d80ee61848eb9b8d0dbd3bc72cce71921cf0819",
      "evidence_status": "accepted",
      "execute_once_allowed": false,
      "final_state": null,
      "freshness_status": "immutable_terminal",
      "integrity_status": "passed",
      "intrusive_action_count": 0,
      "lane": "heal_friend",
      "live_promotion": false,
      "ordinal": 11,
      "phase": "P11",
      "predecessor_ids": [
        "p10-equipment-shadow-acceptance"
      ],
      "previous_evidence_sha256": "9bce6d49dc9177aa962a9eec7d80ee61848eb9b8d0dbd3bc72cce71921cf0819",
      "result_status": "operational_acceptance_complete",
      "retry_scheduled": null,
      "runtime_actions": false,
      "terminal": true
    },
    {
      "age_seconds": 127081,
      "attempt_count": 1,
      "bindings": [
        {
          "actual_sha256": "67c27a26797b0b01e4f8dfccec4e02b0e5f454ca6818434709e4b55850f49810",
          "expected_sha256": "67c27a26797b0b01e4f8dfccec4e02b0e5f454ca6818434709e4b55850f49810",
          "mode": "field_match",
          "path": "runtime/solteria_helper_dev/p12_conditions_execute_once_plan.json",
          "role": "plan",
          "status": "passed"
        },
        {
          "actual_sha256": "6ce8a238169ffd4aa0762603cc1b1a1457072d8ce45005e5f8e34a549c94bfec",
          "expected_sha256": "6ce8a238169ffd4aa0762603cc1b1a1457072d8ce45005e5f8e34a549c94bfec",
          "mode": "canonical_json_sha256",
          "path": "runtime/solteria_helper_dev/p12_conditions_session_approval.json",
          "role": "approval",
          "status": "passed"
        },
        {
          "actual_sha256": "125af0ec0e73ca8015b50ee8b08392ab76fb3637145f272743cdb96b4851f69c",
          "expected_sha256": "125af0ec0e73ca8015b50ee8b08392ab76fb3637145f272743cdb96b4851f69c",
          "mode": "canonical_json_sha256",
          "path": "runtime/solteria_helper_dev/p12_conditions_execute_once_trace.json",
          "role": "trace",
          "status": "passed"
        }
      ],
      "blockers": [],
      "created_at": "2026-07-15T07:04:51.648000Z",
      "decision_id": "p12-conditions-execute-once",
      "decision_status": "accepted",
      "dispatch_allowed": false,
      "downstream_authority_granted": false,
      "evidence_path": "runtime/solteria_helper_dev/p12_conditions_execute_once_receipt.json",
      "evidence_schema_version": "ctoa.p12-conditions-execute-once-receipt.v1",
      "evidence_sha256": "ce9017f67a8efac96903fead66a925a3aa6e237352883ee9ac99e44da4e5fba8",
      "evidence_status": "accepted",
      "execute_once_allowed": false,
      "final_state": "killed_and_disarmed",
      "freshness_status": "immutable_terminal",
      "integrity_status": "passed",
      "intrusive_action_count": 1,
      "lane": "conditions",
      "live_promotion": false,
      "ordinal": 12,
      "phase": "P12",
      "predecessor_ids": [
        "p9-conditions-shadow-acceptance"
      ],
      "previous_evidence_sha256": "ce9017f67a8efac96903fead66a925a3aa6e237352883ee9ac99e44da4e5fba8",
      "result_status": "operational_acceptance_complete",
      "retry_scheduled": false,
      "runtime_actions": false,
      "terminal": true
    },
    {
      "age_seconds": 114599,
      "attempt_count": 1,
      "bindings": [
        {
          "actual_sha256": "d041db806c6417b018c6ae390e3d384ccec9bead2a77e498a582093bf7c823e0",
          "expected_sha256": "d041db806c6417b018c6ae390e3d384ccec9bead2a77e498a582093bf7c823e0",
          "mode": "field_match",
          "path": "runtime/solteria_helper_dev/p12_equipment_execute_once_plan.json",
          "role": "plan",
          "status": "passed"
        },
        {
          "actual_sha256": "7a232baf0b87abdac05cf71998cd17962187b0e9eab25aa5ac6f169489821eec",